{
  "$schema": "../../../schema/tool.schema.json",
  "id": "other-tools",
  "source": {
    "book": "Livro do Jogador 2024",
    "language": "pt-BR",
    "chapter": 6,
    "chapterTitle": "Equipamento",
    "pdfPath": "doc/livro-jogador.pdf",
    "pageRanges": [
      [
        219,
        219
      ],
      [
        226,
        239
      ]
    ],
    "extractedAt": "2026-06-25T01:39:43.402Z"
  },
  "description": "Essas ferramentas ajudam em aventuras e outras\natividades.",
  "tools": [
    {
      "id": "ferramentas-de-ladrao",
      "name": "Ferramentas de Ladrão",
      "cost": "25 PO",
      "attribute": "Destreza",
      "weight": "0,5 kg",
      "useObject": "Abrir uma fechadura (CD 15) ou desarmar uma\narmadilha (CD 15)",
      "crafting": null,
      "variants": null
    },
    {
      "id": "ferramentas-de-navegador",
      "name": "Ferramentas de Navegador",
      "cost": "25 PO",
      "attribute": "Sabedoria",
      "weight": "1 kg",
      "useObject": "Traçar uma rota (CD 10) ou determinar a posição\nobservando as estrelas (CD 15)",
      "crafting": null,
      "variants": null
    },
    {
      "id": "instrumento-musical",
      "name": "Instrumento Musical",
      "cost": "Varia",
      "attribute": "Carisma",
      "weight": "Varia",
      "useObject": "Tocar uma música conhecida (CD 10) ou\nimprovisar uma música (CD 15)",
      "crafting": null,
      "variants": "Alaúde (35 PO, 1 kg), Flauta (2 PO, 0,5 kg), Flauta\nde Pan (12 PO, 1 kg), Gaita de Foles (30 PO, 3 kg), Lira\n(30 PO, 1 kg), Oboé (2 PO, 0,5 kg), Tambor (6 PO, 1,5 kg),\nTrombeta (3 PO, 1 kg), Violino (30 PO, 0,5 kg), Xilofone (25\nPO, 5 kg)"
    },
    {
      "id": "kit-de-disfarce",
      "name": "Kit de Disfarce",
      "cost": "25 PO",
      "attribute": "Carisma",
      "weight": "1,5 kg",
      "useObject": "Aplicar maquiagem (CD 10)",
      "crafting": "Fantasia",
      "variants": null
    },
    {
      "id": "kit-de-falsificacao",
      "name": "Kit de Falsificação",
      "cost": "15 PO",
      "attribute": "Destreza",
      "weight": "2,5 kg",
      "useObject": "Imitar 10 ou menos palavras escritas de outra\npessoa (CD 15) ou duplicar um selo de cera (CD 20)",
      "crafting": null,
      "variants": null
    },
    {
      "id": "kit-de-herbalismo",
      "name": "Kit de Herbalismo",
      "cost": "5 PO",
      "attribute": "Inteligência",
      "weight": "1,5 kg",
      "useObject": "Identificar uma planta (CD 10)",
      "crafting": "Antitoxina, Kit de Curandeiro, Poção de Cura, Vela",
      "variants": null
    },
    {
      "id": "kit-de-jogos",
      "name": "Kit de Jogos",
      "cost": "Varia",
      "attribute": "Sabedoria",
      "weight": "—",
      "useObject": "Discernir se alguém está trapaceando (CD 10) ou\nganhar o jogo (CD 20)",
      "crafting": null,
      "variants": "Dados (1 PP), Xadrez-do-Dragão (1 PO), Baralho\n(5 PP), Conjunto do Jogo dos Três Dragões (1 PO)"
    },
    {
      "id": "kit-de-veneno",
      "name": "Kit de Veneno",
      "cost": "50 PO",
      "attribute": "Inteligência",
      "weight": "1 kg",
      "useObject": "Detectar um objeto envenenado (CD 10)",
      "crafting": "Veneno Básico",
      "variants": null
    }
  ]
}